{
  "schemaVersion": 1,
  "auditRunId": "audit-30187979088",
  "journeyId": "journey-invite-member-2",
  "status": "passed",
  "terminalReason": "completed",
  "createdAt": "2026-07-26T04:34:31.516Z",
  "expiresAt": "2026-07-26T04:49:31.516Z",
  "publicationNonce": "pub-7100246d-685d-4c57-94a1-feaff632d81c",
  "provenance": {
    "auditEngine": "0.0.0+mem22",
    "playwright": "1.61.1",
    "chromium": "149.0.7827.55",
    "axe": "4.12.1",
    "image": "mcr.microsoft.com/playwright:v1.61.1-noble@sha256:5b8f294aff9041b7191c34a4bab3ac270157a28774d4b0660e9743297b697e48",
    "action": "guillermo-rebolledo/a11y-agent/packages/action@76a12cdfbcea4ab5eb1cf1d4d7763f4449c14d76",
    "workflow": "guillermo-rebolledo/a11y-agent/.github/workflows/customer-audit.yml@0f1968a9a72e52ab1c1abdb1d23c4f4a6b0cdd52",
    "repository": "guillermo-rebolledo/a11y-demo",
    "commit": "590d95f3009cb4d096a2c6bfb1f0709b06fa7cdf",
    "runId": "30187979088",
    "runAttempt": 1,
    "runnerEnvironment": "github-hosted",
    "runnerArchitecture": "X64"
  },
  "assertions": [
    {
      "id": "invalid-authentication-rejected",
      "status": "passed"
    },
    {
      "id": "synthetic-authentication-established",
      "status": "passed"
    },
    {
      "id": "invitation-status-visible",
      "status": "passed"
    },
    {
      "id": "session-material-absent",
      "status": "passed"
    }
  ],
  "findings": [],
  "measurements": {
    "startupMs": 152,
    "runtimeMs": 1219,
    "actionMinutes": 0.0203
  }
}
